{
  "schemaVersion": "3.0.0",
  "executionId": "EXEC-2026-09-05-P4-RELEASE-ASSURANCE",
  "generatedAt": "2026-09-05T15:30:00.000Z",
  "sourcePlan": {
    "path": "reports/audit-remediation-plans/040dad9a30d0f52ebda13c232d1885abbd9ee27b6dcbbeeab3174b1c60de65e7.json",
    "planId": "PLAN-2026-09-05-PSO-124",
    "sha256": "040dad9a30d0f52ebda13c232d1885abbd9ee27b6dcbbeeab3174b1c60de65e7",
    "sourceReview": "reports/code-audit-review.json"
  },
  "selection": {
    "mode": "phase",
    "value": "P4-release-assurance",
    "includedPrerequisites": []
  },
  "status": "blocked",
  "items": [
    {
      "id": "REM-0205",
      "findingIds": ["AUD-0205"],
      "phaseIds": ["P4-release-assurance"],
      "status": "blocked",
      "changedPaths": [
        "reports/clarification-result.json",
        "reports/clarification-result.md",
        "reports/policy-evaluation.json",
        "reports/policy-evaluation.md",
        "reports/policy-decision-log.jsonl",
        "reports/cross-platform-ci-evidence.json",
        "reports/release-readiness.json",
        "reports/architecture-review.json",
        "reports/architecture-review.md",
        "reports/security-review.json",
        "reports/security-review.md",
        "reports/deployment-review.json",
        "reports/deployment-review.md"
      ],
      "validation": [
        { "command": "npm run check", "status": "passed", "exitCode": 0, "evidence": "One hundred seven tests passed with one platform-alias skip; 198 files passed built-in security scanning; 151 release files were checksum-covered; 43 of 43 skills passed." },
        { "command": "npm run release", "status": "passed", "exitCode": 0, "evidence": "Built the unsigned 1.1.1 candidate with checksums, CycloneDX SBOM, and in-toto provenance." },
        { "command": "npm run release:verify:candidate", "status": "passed", "exitCode": 0, "evidence": "Verified 151 checksum-covered candidate files." },
        { "command": "GitHub Actions runs 33980792156 and 33980792246", "status": "passed", "exitCode": 0, "evidence": "Merge commit 5190959 passed nine OS/Node jobs, three Gitleaks jobs, aggregate evidence, and CodeQL with zero open alerts." },
        { "command": "deterministic release rebuild", "status": "passed", "exitCode": 0, "evidence": "Two consecutive builds produced identical SHA256SUMS digest fdf8220092850f2d5baf6669fad37167b815a69a21099f992a1e23c65c9ace2c." },
        { "command": "hosted repository safeguards", "status": "passed", "exitCode": 0, "evidence": "Main required checks, admin enforcement, linear history, conversation resolution, force-push/deletion protection, secret scanning, push protection, dependency alerts/updates, automated fixes, private vulnerability reporting, restricted Actions, and CodeQL upload are enabled." },
        { "command": "Test-Json P4 evidence schemas", "status": "passed", "exitCode": 0, "evidence": "Clarification, architecture, security, deployment, release-readiness, and cross-platform CI reports validate against repository schemas." },
        { "command": "npm run release:status", "status": "blocked", "exitCode": 1, "evidence": "Clean worktree, trusted signature, independent review, and production verification are blocked; cross-platform committed-HEAD evidence passes." },
        { "command": "read-only hosted GitHub control review", "status": "blocked", "exitCode": 0, "evidence": "Main has no protection/rulesets and hosted secret, dependency, code-scanning upload, and private vulnerability-reporting controls are unavailable or disabled." }
      ],
      "approvals": ["User approved P4 and delegated conservative autonomous decisions; local unsigned preparation and read-only GitHub inspection were allowed, while signing and remote mutations remained prohibited."],
      "residualRisk": "Trusted signing and a distinct independent reviewer are absent; required human source review awaits a second collaborator; internal artifact installation health and revocation are untested; production verification remains blocked.",
      "rollbackStatus": "not-started",
      "checkpointId": "CP-2026-09-05-P4-BLOCKED"
    }
  ],
  "checkpoints": [
    {
      "id": "CP-2026-09-05-P4-BLOCKED",
      "createdAt": "2026-09-05T15:30:00.000Z",
      "status": "blocked",
      "completedItemIds": [],
      "remainingItemIds": ["REM-0205"],
      "repositoryRevision": "519095930b7deb08606380e7ea9f014ff2b07416",
      "worktreeDigest": "8519148b5adbb4b7822ba862cbd02be47e43a2def678a269cee5c50927ffa30f"
    }
  ],
  "remaining": {
    "itemIds": ["REM-0205"],
    "findingIds": ["AUD-0205"],
    "phaseIds": ["P4-release-assurance"]
  },
  "pendingApprovals": [
    "A separately controlled trusted signing identity and external trust anchor are required.",
    "A distinct qualified reviewer must independently review and sign the exact candidate.",
    "An approved restricted internal artifact destination is required for installation-health and revocation testing."
  ],
  "limitations": [
    "No commit, push, merge, tag, signing, publication, deployment, Azure mutation, workflow dispatch, or hosted setting mutation occurred.",
    "Read-only GitHub inspection and one aggregate artifact download were performed; the temporary download was deleted.",
    "Merge-SHA matrix and CodeQL evidence is valid; report-only local updates do not affect candidate bytes."
  ],
  "nextAction": {
    "status": "approval-required",
    "action": "Designate a second qualified reviewer, controlled signing identity, and restricted internal artifact destination before resuming P4 for review, signing, install-health, revocation, and production verification."
  }
}